9780007105045,0007105045,Tree and Leaf,The Homecoming of Beorhtnoth : Beorhthelm's Son,John Ronald Reuel Tolkien,Literary Collections,http://books.google.com/books/content?id=aPb_AAIcwZ0C&printsec=frontcover&img=1&zoom=1&source=gbs_api,"""The two works 'On fairy-stories' and 'Leaf by Niggle' were first brought together to form the book 'Tree and leaf' in 1964. In this new edition a third element is added: the poem Mythopoeia, the making of myths...""--Preface.",2001,4.09,176,2245
9780007111503,0007111509,Partners in Crime,,Agatha Christie,"Beresford, Tommy (Fictitious character)",http://books.google.com/books/content?id=L0bfy0zgkegC&printsec=frontcover&img=1&zoom=1&source=gbs_api,"The Famous Volume Of Tommy & Tuppence Linked Short Stories, Reissued In A New Look To Coincide With The Brand New Series Of Tommy & Tuppence Bbc Movies. Tommy And Tuppence Beresford Were Restless For Adventure, So When They Were Asked To Take Over Blunt S International Detective Agency, They Leapt At The Chance. After Their Triumphant Recovery Of A Pink Pearl, Intriguing Cases Kept On Coming Their Way: A Stabbing On Sunningdale Golf Course; Cryptic Messages In The Personal Columns Of Newspapers; And Even A Box Of Poisoned Chocolates.",2001,3.77,347,9506
9780007113804,0007113803,Murder in Mesopotamia,,Agatha Christie,Detective and mystery stories,http://books.google.com/books/content?id=oFkbc7BbYN0C&printsec=frontcover&img=1&zoom=1&source=gbs_api,"An archaeologist's wife is murdered on the shores of the River Tigris in Iraq... It was clear to Amy Leatheran that something sinister was going on at the Hassanieh dig in Iraq; something associated with the presence of 'Lovely Louise', wife of celebrated archaeologist Dr Leidner. In a few days' time Hercule Poirot was due to drop in at the excavation site. But with Louise suffering from terrifying hallucinations, and tension within the group becoming almost unbearable, Poirot might just be too late...",2001,3.89,264,25692
9780007116263,0007116268,"The Lord of the Rings, the Return of the King",Visual Companion,Jude Fisher,Imaginary wars and battles,http://books.google.com/books/content?id=kNBnQgAACAAJ&printsec=frontcover&img=1&zoom=1&source=gbs_api,"A visual guide to the third in the Lord of the Rings movie trilogy. A large-format, full-colour guide to the characters, places, landscapes, artefacts, battles, and costumes as seen in the film, it features images, informative text and specially commissioned extras.",2003,4.59,72,22
9780007117536,0007117531,All Families are Psychotic,,Douglas Coupland,Dysfunctional families,http://books.google.com/books/content?id=jYBsNp6NPVoC&printsec=frontcover&img=1&zoom=1&source=gbs_api,"On the eve of the next Space Shuttle mission, a divided family comes together... Warm, witty and wise, All Families Are Psychotic is Coupland at the very top of his form: 'Irresistibly hilarious, unique and wonderful' Independent on Sunday In a cheap motel an hour from Cape Canaveral, Janet Drummond takes her medication, and does a rapid tally of the whereabouts of her children. Wade has spent the night in jail; suicidal Bryan is due to arrive at any moment with his vowel-free girlfriend, Shw; and then there is Sarah, 'a bolt of lightning frozen in midflash' -- here in Orlando to be the star of Friday's shuttle mission. With Janet's ex-husband and his trophy wife also in town, Janet spends a moment contemplating her family, and where it all went wrong. Or did it?",2002,3.69,279,350
9780007119332,000711933X,Death in the Clouds,,Agatha Christie,Detective and mystery stories,http://books.google.com/books/content?id=M8iyckq4GQ0C&printsec=frontcover&img=1&zoom=1&source=gbs_api,"A woman is killed by a poisoned dart in the enclosed confines of a commercial passenger plane... From seat No.9, Hercule Poirot was ideally placed to observe his fellow air passengers. Over to his right sat a pretty young woman, clearly infatuated with the man opposite; ahead, in seat No.13, sat a Countess with a poorly-concealed cocaine habit; across the gangway in seat No.8, a detective writer was being troubled by an aggressive wasp. What Poirot did not yet realize was that behind him, in seat No.2, sat the slumped, lifeless body of a woman.",2001,3.8,333,21123
9780007119356,0007119356,Appointment with Death,,Agatha Christie,Detective and mystery stories,http://books.google.com/books/content?id=lSYwsRkcw4YC&printsec=frontcover&img=1&zoom=1&source=gbs_api,"A repugnant Amercian widow is killed during a trip to Petra... Among the towering red cliffs of Petra, like some monstrous swollen Buddha, sat the corpse of Mrs Boynton. A tiny puncture mark on her wrist was the only sign of the fatal injection that had killed her. With only 24 hours available to solve the mystery, Hercule Poirot recalled a chance remark he'd overheard back in Jerusalem: 'You see, don't you, that she's got to be killed?' Mrs Boynton was, indeed, the most detestable woman he'd ever met...",2001,3.86,303,24859
9780007120680,0007120680,Hallowe'en Party,,Agatha Christie,"Poirot, Hercule (Fictitious character)",http://books.google.com/books/content?id=Qlx98EGK_jMC&printsec=frontcover&img=1&zoom=1&source=gbs_api,"No one believes a little girl when she insists that she has witnessed a murder until she herself turns up drowned, and Hercule Poirot sets out to catch the killer.",2001,3.66,336,18820
9780007120697,0007120699,Hercule Poirot's Christmas,,Agatha Christie,Christmas stories,http://books.google.com/books/content?id=EA0j4Jzn4vAC&printsec=frontcover&img=1&zoom=1&source=gbs_api,"On the night before Christmas, cruel, tyrannical, filthy-rich Simeon Lee is found in his locked bedroom with his throat cut. Now Hercule Poirot must put his deductive powers to the test to solve one of his most chilling cases--and to prevent a clever killer from spilling more blood.",2001,3.93,335,23113
9780007120819,0007120818,The Big Four,,Agatha Christie,Detective and mystery stories,http://books.google.com/books/content?id=wcOQUSWQEdUC&printsec=frontcover&img=1&zoom=1&source=gbs_api,"A ruthless international cartel seeks world domination... Framed in the doorway of Poirot's bedroom stood an uninvited guest, coated from head to foot in dust. The man's gaunt face stared for a moment, then he swayed and fell. Who was he? Was he suffering from shock or just exhaustion? Above all, what was the significance of the figure 4, scribbled over and over again on a sheet of paper? Poirot finds himself plunged into a world of international intrigue, risking his life to uncover the truth about 'Number Four'.",2002,3.59,272,22155
9780007120864,0007120869,The Thirteen Problems,,Agatha Christie,"Detective and mystery stories, English",http://books.google.com/books/content?id=MK9JNwoZAncC&printsec=frontcover&img=1&zoom=1&source=gbs_api,The Tuesday Night Club is a venue where locals challenge Miss Marple to solve recent crimes... One Tuesday evening a group gathers at Miss Marple's house and the conversation turns to unsolved crimes... The case of the disappearing bloodstains; the thief who committed his crime twice over; the message on the death-bed of a poisoned man which read 'heap of fish'; the strange case of the invisible will; a spiritualist who warned that 'Blue Geranium' meant death... Now pit your wits against the powers of deduction of the 'Tuesday Night Club'.,2002,3.89,315,12840
9780007120871,0007120877,They Do it with Mirrors,,Agatha Christie,American fiction,http://books.google.com/books/content?id=HUuQYGppZi8C&printsec=frontcover&img=1&zoom=1&source=gbs_api,"A man is shot at in a juvenile reform home - but someone else dies... Miss Marple senses danger when she visits a friend living in a Victorian mansion which doubles as a rehabilitiation centre for delinquents. Her fears are confirmed when a youth fires a revolver at the administrator, Lewis Serrocold. Neither is injured. But a mysterious visitor, Mr Gilbrandsen, is less fortunate - shot dead simultaneously in another part of the building. Pure coincidence? Miss Marple thinks not, and vows to discover the real reason for Mr Gilbrandsen's visit.",2002,3.75,284,415
9780007120963,0007120966,A Murder is Announced,,Agatha Christie,"Detective and mystery stories, English",http://books.google.com/books/content?id=QEEvzeAkdzoC&printsec=frontcover&img=1&zoom=1&source=gbs_api,"The villagers of Chipping Cleghorn are amazed by an advertisement in the local paper which reads ""A murder is announced and will take place on Friday October 29th, at Little Paddocks at 6.30pm. Unable to resist, a crowd begins to gather at the house at the appointed time. But when a man is killed in what looks like an attempted robbery, Miss Marple becomes involved.",2002,3.98,382,680
9780007120987,0007120982,The Mirror Crack'd from Side to Side,,Agatha Christie,"Marple, Jane (Fictitious character)",http://books.google.com/books/content?id=lTYId7FIJEsC&printsec=frontcover&img=1&zoom=1&source=gbs_api,"One Minute, Silly Heather Badcock Had Been Gabbling On At Her Movie Idol, The Glamorous Marina Gregg. The Next, Heather Suffered A Massive Seizure. But For Whom Was The Deadly Poison Really Intended? Marina S Frozen Expression Suggested She Had Witnessed Something Horrific. But, While Others Searched For Material Evidence, Jane Marple Conducted A Very Different Investigation Into Human Nature.",2002,3.91,351,23249
9780007121007,0007121008,Mrs McGinty's Dead,,Agatha Christie,Belgians,http://books.google.com/books/content?id=gcS0d5HhGEEC&printsec=frontcover&img=1&zoom=1&source=gbs_api,"An old widow is brutally killed in the parlour of her cottage... Mrs McGinty died from a brutal blow to the back of her head. Suspicion fell immediately on her shifty lodger, James Bentley, whose clothes revealed traces of the victim's blood and hair. Yet something was amiss: Bentley just didn't look like a murderer. Poirot believed he could save the man from the gallows - what he didn't realise was that his own life was now in great danger...",2002,3.83,328,525
9780007121014,0007121016,Taken at the Flood,,Agatha Christie,Fiction,http://books.google.com/books/content?id=3gWlxIFlMEwC&printsec=frontcover&img=1&zoom=1&source=gbs_api,"A Few Weeks After Marrying An Attractive Young Widow, Gordon Cloade Is Tragically Killed By A Bomb Blast In The London Blitz. Overnight, The Former Mrs Underhay Finds Herself In Sole Possession Of The Cloade Family Fortune. Shortly Afterwards, Hercule Poirot Receives A Visit From The Dead Man S Sister-In-Law Who Claims She Has Been Warned By Spirits That Mrs Underhay S First Husband Is Still Alive. Poirot Has His Suspicions When He Is Asked To Find A Missing Person Guided Only By The Spirit World. Yet What Mystifies Poirot Most Is The Woman S True Motive For Approaching Him&",2002,3.71,352,8852
9780007121021,0007121024,The Hollow,,Agatha Christie,Detective and mystery stories,http://books.google.com/books/content?id=-f1h4e0hl0oC&printsec=frontcover&img=1&zoom=1&source=gbs_api,"Lucy Angkatell Invited Hercule Poirot To Lunch. To Tease The Great Detective, Her Guests Stage A Mock Murder Beside The Swimming Pool. Unfortunately, The Victim Plays The Scene For Real. As His Blood Drips Into The Water, John Christow Gasps One Final Word: Henrietta . In The Confusion, A Gun Sinks To The Bottom Of The Pool. Poirot S Enquiries Reveal A Complex Web Of Romantic Attachments. It Seems Everyone In The Drama Is A Suspect And Each A Victim Of Love.",2002,3.79,384,13022
9780007121106,0007121105,Third Girl,,Agatha Christie,Belgians,http://books.google.com/books/content?id=Dbh7nUkG_6cC&printsec=frontcover&img=1&zoom=1&source=gbs_api,"A perplexed girl thinks she might have killed someone... Three single girls shared the same London flat. The first worked as a secretary; the second was an artist; the third who came to Poirot for help, disappeared convinced she was a murderer. Now there were rumours of revolvers, flick-knives and blood stains. But, without hard evidence, it would take all Poirot's tenacity to establish whether the third girl was guilty innocent or insane...",2002,3.62,365,13705
9780007122585,0007122586,The Secret of Chimneys,,Agatha Christie,"Battle, Superintendent (Fictitious character)",http://books.google.com/books/content?id=1OluX5g96OcC&printsec=frontcover&img=1&zoom=1&source=gbs_api,A young drifter finds more than he bargained for when he agrees to deliver a parcel to an English country house...,2001,3.86,400,11110
9780007124015,0007124015,The Lord of the Rings,,J. R. R. Tolkien,"Baggins, Frodo (Fictitious character)",,"Sauron has gathered the Rings of Power - the means by which he will be able to rule the world. All he needs now is the Ruling Ring, which has fallen into the hands of the hobbit Bilbo Baggins. Frodo Baggins is entrusted to foil Sauron's plans.",2001,4.49,1546,187
9780007126903,0007126905,The Metaphysical Club,,Louis Menand,Cambridge (Mass.),http://books.google.com/books/content?id=C3Gkwi3SfmMC&printsec=frontcover&img=1&zoom=1&source=gbs_api,"In an absorbing narrative about personalities and social history, Menand discusses the Metaphysical Club, an informal group that met in Cambridge, Massachusetts, in 1872, to talk about ideas. Members included Oliver Wendell Holmes, Jr., William James, and Charles Sanders Peirce. 21 photos.",2002,4.07,560,3311
9780007127740,000712774X,The illustrated man,,Ray Bradbury,Fiction,http://books.google.com/books/content?id=kePqlVft1bQC&printsec=frontcover&img=1&zoom=1&source=gbs_api,,2002,4.14,186,56781
9780007129652,0007129653,Wilkins' Tooth,,Diana Wynne Jones,Business enterprises,http://books.google.com/books/content?id=lXUSHqQfOD8C&printsec=frontcover&img=1&zoom=1&source=gbs_api,"OWN BACK LIMITEDREVENGE ARRANGED, PRICE ACCORDING TO TASK, ALL DIFFICULT TASKS UNDERTAKEN, TREASURE HUNTED, ETC. It seemed like a marvellous scheme at the time! Frank and Jess had set up the business because they needed money - their pocket-money had been stopped just when Frank owed Buster Knell ten pence. Their father had put a quick stop to ERRANDS RUN, so why not try something that was bad instead? Offering to do dreadful things that other people didn't dare to do? So they pinned up the notice on the potting-shed and waited for customers. But of course, nothing's ever THAT straightforward.",2002,3.59,207,69
9780007130313,0007130317,Cut,,Patricia McCormick,Emotional problems,http://books.google.com/books/content?id=Q140Mlie138C&printsec=frontcover&img=1&zoom=1&source=gbs_api,"Fifteen-year old Callie is so withdrawn that she's not speaking to anyone - including her therapist at Sea Pines, known to its guests as 'Sick Minds' - the residential treatment facility where her parents and doctor send her after discovering that she cuts herself. Her story unfolds primarily through dramatic monologues, gradually revealing the family turmoil that led to her self-destructive behaviour.",2002,3.76,173,107
9780007135653,0007135653,The Lord of the Rings,The Art of The Return of the King,Gary Russell,Characters and characteristics in motion pictures,http://books.google.com/books/content?id=oEZ6AAAACAAJ&printsec=frontcover&img=1&zoom=1&source=gbs_api,"With complete access to artwork created over a five-year period, this guide illustrates the creative development of The Return of the King. It contains over 600 images, from the earliest pencil sketches and conceptual drawings to magnificent paintings, sculptures and digital imagery that shaped the look of the film. Contributing artists include John Howe and Alan Lee, artists who have inspired Peter Jackson's vision of Middle-earth and worked with him to bring the trilogy to the big screen. Peter Jackson himself provides the afterword in which he discusses the importance of the conceptual art to the film. It covers most aspects of the eagerly awaited finale to the enormously successful trilogy, from locations and costumes to weaponry and creatures. The artists who created all of these diverse elements explain how they contributed to the development of the film.",2004,4.54,224,28
9780007136582,0007136587,The Lord of the Rings,,John Ronald Reuel Tolkien,"Fantasy fiction, English",http://books.google.com/books/content?id=LwO-vgEACAAJ&printsec=frontcover&img=1&zoom=1&source=gbs_api,"Since it was first published in 1954, 'The Lord of the Rings' has been a book people have treasured. Steeped in unrivalled magic and otherworldliness, its sweeping fantasy has touched the hearts of young and old alike. Well over 100 million copies of its many editions have been sold around the world, and occasional collectors’ editions become prized and valuable items of publishing. With the epic trilogy now being released on film, images of the characters and landscapes have become eagerly sought after. Much of the look of the movies is based on Alan Lee’s paintings, giving this Centenary edition of Tolkien’s great work new relevance for the ever-growing number of fans.",2002,4.49,1200,680
9780007136599,0007136595,The Fellowship of the Ring,,John Ronald Reuel Tolkien;Alan Lee,"Baggins, Frodo (Fictitious character)",http://books.google.com/books/content?id=K7xSPgAACAAJ&printsec=frontcover&img=1&zoom=1&source=gbs_api,"Tolkien's classic fantasy about the quest to save Middle-Earth--and the basis for Peter Jackson's Academy Award(-winning film trilogy--is now available in these Young Reader's Editions. Each book of the trilogy is available individually, or together in a three-volume paperback boxed set.",2002,4.35,410,56
9780007137336,0007137338,Lirael,Daughter of the Clayr,Garth Nix,Fantasy fiction,http://books.google.com/books/content?id=sDzU8TpKvQAC&printsec=frontcover&img=1&zoom=1&source=gbs_api,"When a dangerous necromancer threatens to unleash a long-buried evil, Lirael and Prince Sameth are drawn into a battle to save the Old Kingdom and reveal their true destinies. Suggested level: secondary.",2004,4.3,527,1339
9780007149124,0007149123,Tales from the Perilous Realm,,John Ronald Reuel Tolkien,"Fairy tales, English",http://books.google.com/books/content?id=Wla7NwAACAAJ&printsec=frontcover&img=1&zoom=1&source=gbs_api,"Never before published in a single volume, Tolkien's four novellas (""Farmer Giles of Ham, Leaf by Niggle, Smith of Wootton Major,"" and ""Roverandom"") and one book of poems (""The Adventures of Tom Bombadil"") are gathered together in a fully illustrated set.",2002,4.08,178,2964
9780007149612,0007149611,Breaking Open the Head,A Visionary Journey from Cynicism to Shamanism,Daniel Pinchbeck,Hallucinogenic drugs,http://books.google.com/books/content?id=QIMaviqqoQoC&printsec=frontcover&img=1&zoom=1&source=gbs_api,A new 'The Doors of Perception' for the 21st century? A visionary journey from cynicism to shamanism by a brilliant young US writer.,2004,4.06,336,46
9780007149827,0007149824,The Yiddish Policemen's Union,A Novel,Michael Chabon,Fiction,http://books.google.com/books/content?id=-reD1g77BfsC&printsec=frontcover&img=1&zoom=1&source=gbs_api,"For sixty years, Jewish refugees and their descendants have prospered in the Federal District of Sitka, a ""temporary"" safe haven created in the wake of revelations of the Holocaust and the shocking 1948 collapse of the fledgling state of Israel. Proud, grateful, and longing to be American, the Jews of the Sitka District have created their own little world in the Alaskan panhandle, a vibrant, gritty, soulful, and complex frontier city that moves to the music of Yiddish. For sixty years they have been left alone, neglected and half-forgotten in a backwater of history. Now the District is set to revert to Alaskan control, and their dream is coming to an end: once again the tides of history threaten to sweep them up and carry them off into the unknown. But homicide detective Meyer Landsman of the District Police has enough problems without worrying about the upcoming Reversion. His life is a shambles, his marriage a wreck, his career a disaster. He and his half-Tlingit partner, Berko Shemets, can't catch a break in any of their outstanding cases. Landsman's new supervisor is the love of his life—and also his worst nightmare. And in the cheap hotel where he has washed up, someone has just committed a murder—right under Landsman's nose. Out of habit, obligation, and a mysterious sense that it somehow offers him a shot at redeeming himself, Landsman begins to investigate the killing of his neighbor, a former chess prodigy. But when word comes down from on high that the case is to be dropped immediately, Landsman soon finds himself contending with all the powerful forces of faith, obsession, hopefulness, evil, and salvation that are his heritage—and with the unfinished business of his marriage to Bina Gelbfish, the one person who understands his darkest fears. At once a gripping whodunit, a love story, an homage to 1940s noir, and an exploration of the mysteries of exile and redemption, The Yiddish Policemen's Union is a novel only Michael Chabon could have written.",2007,3.7,414,51219
9780007150304,000715030X,"Beware, Princess Elizabeth",,Carolyn Meyer,Children's stories,http://books.google.com/books/content?id=wPBpR4AFNJ0C&printsec=frontcover&img=1&zoom=1&source=gbs_api,A matter of life and death - and the Throne of England,2003,3.88,242,78
9780007151240,0007151241,The Family Way,,Tony Parsons,Parenthood,http://books.google.com/books/content?id=dJEIxdYmnU8C&printsec=frontcover&img=1&zoom=1&source=gbs_api,"It should be the most natural thing in the world. But in Tony Parsons' latest bestseller, three couples discover that Mother Nature can be one hell of a bitch.",2005,3.51,400,2095
9780007151677,0007151675,Endless Night,,Agatha Christie,FICTION,http://books.google.com/books/content?id=kY1wuNfgmFQC&printsec=frontcover&img=1&zoom=1&source=gbs_api,"Gipsy S Acre Was A Truly Beautiful Upland Site With Views Out To Sea And In Michael Rogers It Stirred A Child-Like Fantasy. There, Among The Dark Fir Trees, He Planned To Build A House, Find A Wonderful Girl And Live Happily Ever After, Yet, As He Left The Village, A Shadow Of Menace Hung Over The Land. For This Was The Place Where Accidents Happened. Perhaps Michael Should Have Heeded The Locals Warnings: There S No Luck For Them As Meddles With Gipsy S Acre .",2002,3.77,303,12740
9780007153589,0007153589,How to be Alone,,Jonathan Franzen,Literary Collections,http://books.google.com/books/content?id=ozVWaXd9xvwC&printsec=frontcover&img=1&zoom=1&source=gbs_api,"'The Harper's Essay' is reprinted in this volume alongside personal essays and painstaking, often funny reportage. Although his subjects range widely, each piece wrestles with the erosion of civic life and private dignity, and the hidden persistence of loneliness in postmodern America.",2004,3.6,306,327
9780007154845,0007154844,The Mysterious Mr. Quin,,Agatha Christie,Detective and mystery stories,http://books.google.com/books/content?id=n0aMDV7Lm4sC&printsec=frontcover&img=1&zoom=1&source=gbs_api,"A mysterious stranger appears at a New Year's Eve party, becoming the enigmatic sleuthing sidekick to the snobbish Mr Satterthwaite... So far, it had been a typical New Year's Eve house party. But Mr Satterthwaite - a keen observer of human nature - sensed that the real drama of the evening was yet to unfold. So it proved when a mysterious stranger arrived after midnight. Who was this Mr Quin? And why did his presence have such a pronounced effect on Eleanor Portal, the woman with the dyed-black hair?",2003,3.72,396,7514
9780007154883,0007154887,The Listerdale Mystery,,Agatha Christie,Detective and mystery stories,http://books.google.com/books/content?id=J1tLGz5G84EC&printsec=frontcover&img=1&zoom=1&source=gbs_api,"A selection of mysteries, some light-hearted, some romantic, some very deadly... Twelve tantalizing cases... the curious disappearance of Lord Listerdale; a newlywed's fear of her ex-fiance; a strange encounter on a train; a domestic murder investigation; a wild man's sudden personality change; a retired inspector's hunt for a murderess; a young woman's impersonation of a duchess; a necklace hidden in a basket of cherries; a mystery writer's arrest for murder; an astonishing marriage proposal; a soprano's hatred for a baritone; the case of the rajah's emerald. All have one thing in common: the skilful hand of Agatha Christie.",2003,3.55,317,178
9780007158058,000715805X,The Real Trial of Oscar Wilde,,Merlin Holland,Biography & Autobiography,http://books.google.com/books/content?id=QfNgQfTKcg0C&printsec=frontcover&img=1&zoom=1&source=gbs_api,"Oscar Wilde had one of literary history's most explosive love affairs with Lord Alfred ""Bosie"" Douglas. In 1895, Bosie's father, the Marquess of Queensberry, delivered a note to the Albemarle Club addressed to ""Oscar Wilde posing as sodomite."" With Bosie's encouragement, Wilde sued the Marquess for libel. He not only lost but he was tried twice for ""gross indecency"" and sent to prison with two years' hard labor. With this publication of the uncensored trial transcripts, readers can for the first time in more than a century hear Wilde at his most articulate and brilliant. The Real Trial of Oscar Wilde documents an alarmingly swift fall from grace; it is also a supremely moving testament to the right to live, work, and love as one's heart dictates.",2004,4.04,384,183
9780007158515,0007158513,I Can Read with Me Eyes Shut!,,Dr. Seuss,"Authors, American",http://books.google.com/books/content?id=oyF8U9BRTQwC&printsec=frontcover&img=1&zoom=1&source=gbs_api,Nonsense rhyming story. 4 yrs+,2003,4.2,48,16561
9780007158522,0007158521,"Oh, the Places You'll Go!",,Dr. Seuss,Adventure stories,http://books.google.com/books/content?id=Ev4Llq5fv4IC&printsec=frontcover&img=1&zoom=1&source=gbs_api,From bang-ups and hang-ups to lurches and slumps. Dr. Seuss takes a hilarious look at the mishaps and misadventures that life may have in store for us.,2003,4.35,48,926
