9780007162994,0007162995,If I Die in a Combat Zone,,Tim O'Brien,"Vietnam War, 1961-1975",http://books.google.com/books/content?id=0qUtSvo_MiEC&printsec=frontcover&img=1&zoom=1&source=gbs_api,"Perhaps the best book to emerge from the Vietnam War -- reissued alongside five other jewels of the Flamingo backlist from the 1970s. First published in1973, this intensely personal novel about one foot soldier's tour of duty in Vietnam established Tim O'Brien's reputation as the outstanding chronicler of the Vietnam experience for a generation of Americans. From basic training to the front line and back again, he takes the reader on an unforgettable journey -- walking the minefields of My Lai, fighting the heat and the snipers in an alien land, crawling into the ghostly tunnels -- as he explores the ambiguities of manhood and morality in a war no one believes in.",2003,3.95,208,11
9780007171996,0007171994,The Return of the King,Being the Third Part of The Lord of the Rings,J. R. R. Tolkien,"Baggins, Frodo (Fictitious character)",http://books.google.com/books/content?id=PI9zPwAACAAJ&printsec=frontcover&img=1&zoom=1&source=gbs_api,"THE GREATEST FANTASY EPIC OF OUR TIME While the evil might of the Dark Lord Sauron swarmed out to conquer all Middle-earth, Frodo and Sam struggled deep into Mordor, seat of Sauron's power. To defeat the Dark Lord, the accursed Ring of Power had to be destroyed in the fires of Mount Doom. But the way was impossibly hard, and Frodo was weakening. Weighed down by the compulsion of the Ring he began finally to despair. The awesome conclusion of J.R.R. Tolkien's The Lord of the Rings, beloved by millions of readers around the world.",2003,4.52,554,253
9780007173020,0007173024,The Silmarillion,,John Ronald Reuel Tolkien;Ted Nasmith,Fiction,http://books.google.com/books/content?id=hLH0dtl5NVwC&printsec=frontcover&img=1&zoom=1&source=gbs_api,"Designed to take fans of The Hobbit and The Lord of the Rings deeper into the myths and legends of Middle-earth The Silmarillion is an account of the Elder Days, of the First Age of Tolkien s world. It is the ancient drama to which the characters in The Lord of the Rings look back, and in whose events some of them such as Elrond and Galadriel took part. The tales of The Silmarillion are set in an age when Morgoth, the first Dark Lord, dwelt in Middle-Earth, and the High Elves made war upon him for the recovery of the Silmarils, the jewels containing the pure light of Valinor. Included in the book are several shorter works. The Ainulindale is a myth of the Creation and in the Valaquenta the nature and powers of each of the gods is described. The Akallabeth recounts the downfall of the great island kingdom of Numenor at the end of the Second Age and Of the Rings of Power tells of the great events at the end of the Third Age, as narrated in The Lord of the Rings. This pivotal work features the revised, corrected text and includes, by way of an introduction, a fascinating letter written by Tolkien in 1951 in which he gives a full explanation of how he conceived the early Ages of Middle-earth.""",2004,3.91,386,49
9780007173136,000717313X,I Wish that I Had Duck Feet,,Dr. Seuss;Barney Tobey,Children's stories,http://books.google.com/books/content?id=m9cZAAAACAAJ&printsec=frontcover&img=1&zoom=1&source=gbs_api,"A boy imagines what it would be like if he had such things as duck feet, a whale spout, and an elephant's trunk.",2004,4.16,64,8903
9780007175222,0007175221,Oh Say Can You Say?,,Dr. Seuss,Children's stories,http://books.google.com/books/content?id=r4l8AAAACAAJ&printsec=frontcover&img=1&zoom=1&source=gbs_api,Tie your tongue in terrible knots as you try to read aloud. Nonsense rhyming story.,2004,4.01,36,5726
9780007178636,0007178638,There's a Boy in the Girls' Bathroom,,Louis Sachar,Boys,http://books.google.com/books/content?id=jHE-PgAACAAJ&printsec=frontcover&img=1&zoom=1&source=gbs_api,A study guide for the novel There's a Boy in the Girl's bathroom.,2004,3.98,208,174
9780007179817,0007179812,Microserfs,,Douglas Coupland,Computer programmers,http://books.google.com/books/content?id=N3AmmJIsK6wC&printsec=frontcover&img=1&zoom=1&source=gbs_api,"At computer giant Microsoft, Dan, Susan, Abe, Todd and Bug are struggling to get a life. The job may be super cool, the pay may be astronomical, but they're heading nowhere, and however hard they work, however many shares they earn, they're never going to be as rich as Bill. And besides, with all the hours they're putting in, their best relationships are on e-mail. Something's got to give.",2004,3.88,371,436
9780007179824,0007179820,Miss Wyoming,,Douglas Coupland,Actors,http://books.google.com/books/content?id=2zoTKFNdxpIC&printsec=frontcover&img=1&zoom=1&source=gbs_api,"The brilliant new novel from the bestselling cult author of them all. Susan and John need to disappear -- Susan and John need to find each other. Meet Susan Colgate -- Miss Wyoming. Winner of a hundred teen pageants, child TV soap star, owner of a hideously pushy mother... and now reduced to small, brainless parts in small, brainless movies. Oh, and sole survivor of Flight 802. If she were to walk away from the wreckage now, before the emergency crews get here, she could disappear and nobody would ever know... Meet John Johnson -- action film producer (Bel Air P. I... um, Bel Air P. I. 2), occasional sado-masochist, junkie. He just died -- but only for 5 minutes. But while he was gone, he saw a vision of a woman's face and realized that it was time to escape, to ditch the baggage of being horny, rich, lonely John Johnson and to lose himself. To disappear. Wouldn't it be nice if they were to find themselves and get together?In many ways a reprise of Girlfriend in a Coma, Miss Wyoming represents a further leap forwards into the World According to Coupland -- a witty, genuinely funny look at who we are, how we can change, and how we can make a difference.",2004,3.48,320,110
9780007189953,0007189958,Where Rainbows End,,Cecelia Ahern,Friendship,http://books.google.com/books/content?id=PA7t62vA7SAC&printsec=frontcover&img=1&zoom=1&source=gbs_api,"The new warm and absorbing story from the author of PS, I LOVE YOU is a bittersweet tale of childhood friends Rosie and Alex whose relationship must survive many trials and tribulations, not least the discovery of their true feelings for one another.From naughty children to rebellious teenagers and mixed-up twenty- and thirty-somethings, Rosie and Alex have stuck by each other through thick and thin, even when Alex moved across the Atlantic to Boston and Rosie fell pregnant as a teenager. Alex supportsRosie through one of the most difficult times of her life -- a time when she should be out partying and going to university but is instead changing nappies and coping with a screaming baby. In return, Rosie is there for Alex when he strugglesthrough his medical internship and copes with a messy divorce. Throughout the ups and downs of each other's lives, they have remained a constant, a shoulder to cry on, someone to laugh and share their innermost feelings with.But can their friendship survive the years and the miles and, more critically, when they each marry someone else? Were they meant to be more than just good friends all along? Misunderstandings, circumstances and sheer bad luck",2004,3.94,454,642
9780007190683,0007190689,Poirot,The Complete Ariadne Oliver,Agatha Christie,Authors,http://books.google.com/books/content?id=lbOOJGLxM9MC&printsec=frontcover&img=1&zoom=1&source=gbs_api,"The final POIROT omnibus, featuring the last four appearances of the detective's side-kick, the sleuthing crime novelist Ariadne Oliver: Third Girl, Hallowe'en Party, Elephants Can Remember and The Pale Horse. Poirot and Mrs Oliver continue their sleuthing in the 1960s in four uncharacteristically 'modern' novels with an added twist of danger...Third Girl Poirot finally admits he is growing old as a perplexed girl thinks she may have killed someone. Here Christie dragged Poirot into the swinging 60s and effectively squared him up against a world featuring sex, drugs and hippies. Hallowe'en Party A teenage murder witness is drowned in a tub of apples. This was only the second time Christie wrote about the death of a child, and is all the more engrossing for it. Elephants Can Remember An old husband and wife double murder has never been solved -- until now. This was the very last Poirot story that Agatha Christie wrote, and garnered good reviews. The Pale Horse A priest's death leads to sinister goings-on in an old country inn. This bonus novel featured Mrs Oliver for once without Poirot and was one of Christie's darkest stories, blending witchcraft and murder.",2005,4.2,727,83
9780007191925,0007191928,The Art of The Lord of the Rings,,Gary Russell,Costume,http://books.google.com/books/content?id=zl-PPwAACAAJ&printsec=frontcover&img=1&zoom=1&source=gbs_api,"The definitive guide to the design of the movie, incorporating the best artwork from the trilogy plus many never-before-published paintings, sketches, digital shots and photos.With complete access to artwork created over a five-year period, this authoritative and insightful book illustrates the creative development of the entire Lord of the Rings movie trilogy.This official book contains over 400 exclusive images; the very best artworks from the first three Art books are collected together, many much larger than they have been seen before, with all-new text and information and new interviews with many of the artists. In addition, the book includes 100 unpublished artworks from the extended Director's cuts of the three films, and digital imagery and designs not available when the first books were published.Printed on high-quality art paper, this lavish book is ideal for Tolkien collectors, film enthusiasts and art students and finally allows the massive undertaking of making The Lord of the Rings trilogy to be fully appreciated.",2004,4.52,224,12
9780007195305,0007195303,The Known World,,Edward P. Jones,African American plantation owners,http://books.google.com/books/content?id=CVS9a6lC5CwC&printsec=frontcover&img=1&zoom=1&source=gbs_api,An epic narrative that takes a look at slavery in all of its moral complexities.,2004,3.83,388,437
9780007195718,0007195710,Discover Your Destiny with the Monk Who Sold His Ferrari,The 7 Stages of Self-Awakening,Robin Sharma,Conduct of life,http://books.google.com/books/content?id=4hVbNc8rRfEC&printsec=frontcover&img=1&zoom=1&source=gbs_api,"A potent pathway to self-awakening that will help you to live your greatest life and claim the happiness, prosperity and inner peace that you deserve. From the author of the international bestseller, The Monk Who Sold His Ferrari.",2004,3.9,240,1956
9780007204441,0007204442,Naked Lunch,The Restored Text,William S. Burroughs,Alienation (Social psychology),http://books.google.com/books/content?id=1B36S7t4k5AC&printsec=frontcover&img=1&zoom=1&source=gbs_api,"The anarchic, phenomenally strong-selling classic from the godfather of the Beats: revitalised with a cool new jacket. WELCOME TO INTERZONE...Say hello to Bradley the Buyer, the best narcotics agent in the business. Attend international playboy A.J.'s annual party, where the punch is to be treated with extreme caution. Meet Dr 'Fingers' Schafer, the Lobotomy Kid and his giant centipede, 'The Complete American De-anxietized Man.' And enter the dark and infernal mind of Bill Lee as he pursues his daily quest for the ultimate merchandise...Provocative, influential, morbidly fascinating, Naked Lunch is an apocalyptic ride through the darker recesses of the human psyche.",2005,3.44,289,478
9780007204465,0007204469,Tropic of Cancer,,Henry Miller,Fiction,http://books.google.com/books/content?id=ProgRjTL8FIC&printsec=frontcover&img=1&zoom=1&source=gbs_api,"Miller's groundbreaking first novel, banned in Britain for almost thirty years, now reinvigorated in a new Harper Perennial Modern Classics edition. A penniless and as yet unpublished writer, Henry Miller arrived in Paris in 1930. Leaving behind a disintegrating marriage and an unhappy career in America, he threw himself into the low-life of bohemian Paris with unwavering gusto. A fictional account of Miller's adventures amongst the prostitutes and pimps, the penniless painters and writers of Montparnasse, Tropic of Cancer is an extravagant and rhapsodic hymn to a world of unrivalled eroticism and freedom. Tropic of Cancer's 1934 publication in France was hailed by Samuel Beckett as 'a momentous event in the history of modern writing'. The novel was subsequently banned in the UK and the USA and not released for publication for a further thirty years.",2005,3.69,336,709
9780007205585,0007205589,Close Range,Brokeback Mountain and Other Stories,Annie Proulx,Cowboys,http://books.google.com/books/content?id=f-zI3bgDiCAC&printsec=frontcover&img=1&zoom=1&source=gbs_api,The title story in this collection of shorts now a film from Ang Lee.,2006,3.99,318,466
9780020199854,0020199856,The Love of the Last Tycoon,The Authorized Text,F. Scott Fitzgerald,Fiction,http://books.google.com/books/content?id=3EDbEHca_k8C&printsec=frontcover&img=1&zoom=1&edge=curl&source=gbs_api,Depicts the inner-workings of the Hollywood movie industry and its impact on the fabric of American life.,1994,3.65,169,6836
9780020264736,0020264739,The Song of Rhiannon,The Third Branch of the Mabinogion,Evangeline Walton,Fiction,,"A retelling of The Mabinogion in novel form. Manawydon finally unites with Rhiannon - an aspect of the Goddess - but his happiness is shaken by the appearance of the Gray Man, who seeks vengeance against the living and especially against one who would claim the Goddess.",1992,4.02,208,247
9780020360759,0020360754,Heart Songs and Other Stories,,Annie Proulx,Fiction,http://books.google.com/books/content?id=_K2fswEACAAJ&printsec=frontcover&img=1&zoom=1&source=gbs_api,"Before she wrote her Pulitzer Prize-winning bestseller The Shipping News, E. Annie Proulx was already producing some of the finest short fiction in the country. Here are her collected stories, including two new works never before anthologized. These stories reverberate with rural tradition, the rites of nature, and the rituals of small-town life. The country is blue-collar New England; the characters are native families and the dispossessed working class, whose heritage is challenged by the neorural bourgeoisie from the city; and the themes are as elemental as the landscape: revenge, malice, greed, passion. Told with skill and profundity and crafted by a master storyteller, these are lean, tough tales of an extraordinary place and its people.",1995,3.93,203,1822
9780020442608,0020442602,The voyage of the Dawn Treader,,Clive Staples Lewis,Juvenile Fiction,http://books.google.com/books/content?id=fDD3CfYb70cC&printsec=frontcover&img=1&zoom=1&source=gbs_api,"The ""Dawn Treader"" is the first ship Narnia has seen in centuries. King Caspian has built it for his voyage to find the seven lords, good men whom his evil uncle Mizaz banished when he usurped the throne. The journey takes Edmund, Lucy, and their cousin Eustace to the Eastern Islands, beyond the Silver Sea, toward Aslan's country at the End of the World. Illustrations.",1970,4.09,216,2869
9780020442806,0020442807,"The Chronicles of Narnia: Lion, the witch and the wardrobe",,Clive Staples Lewis,Fairy tales,,,1978,4.26,1425,1446
9780020518600,0020518609,The Short Stories of Ernest Hemingway,,Ernest Hemingway,Fiction,http://books.google.com/books/content?id=Len1AAAACAAJ&printsec=frontcover&img=1&zoom=1&source=gbs_api,Forty-nine stories reflect much of the intensity of Hemingway's own life and environment,1986,4.26,499,106
9780020867401,0020867409,"The Screwtape Letters ; With, Screwtape Proposes a Toast",,Clive Staples Lewis,Christianity,,"One of C.S. Lewis's most imaginative creations, this world-famous book is a humorous correspondence between the devil Screwtape and his apprentice Wormwood, whose job is to produce a human's soul for eternity in hell. Filled with astute insights into temptation, repentance, and grace, this wonderful tale intelligently explores what it means to live a good, honest life and is a favorite of Lewis fans.",1982,4.22,172,313
9780023513206,0023513209,Reason in History,A General Introduction to the Philosophy of History,Georg Wilhelm Friedrich Hegel,Philosophy,http://books.google.com/books/content?id=BCvcYQEACAAJ&printsec=frontcover&img=1&zoom=1&source=gbs_api,,1953,3.64,95,430
9780024181909,0024181900,The Elements of Style,,William Strunk;Elwyn Brooks White,Language Arts & Disciplines,http://books.google.com/books/content?id=ADaMf2tEB7sC&printsec=frontcover&img=1&zoom=1&source=gbs_api,"The only style manual ever to appear on the best-seller lists offers practical, fundamental advice on improving writing skills, promoting a style marked by simplicity, orderliness, and sincerity",1979,4.2,85,204
9780024266408,002426640X,The Presocratics,,Philip Wheelwright,Philosophy,http://books.google.com/books/content?id=V45eMgEACAAJ&printsec=frontcover&img=1&zoom=1&source=gbs_api,Library of Liberal Arts title.,1966,4.04,352,199
9780026995016,0026995018,Spandau,The Secret Diaries,Albert Speer,History,,,1976,4.12,463,6
9780027054903,002705490X,The Rumble Seat Pony,,Clarence William Anderson,"Animals, Treatment of",,"While riding in the rumble seat of their old yellow car, three children spot and adopt a neglected pony.",1971,4.17,46,24
9780027897500,0027897508,The Journey with Grandmother,,Edith Unnerstad,Grandmothers,,"A Swedish boy long ago accompanies his ... [relatives] fromn their Scandinavian farm to ... Russia in an attempt to earn money by making unusual objects from human hair."" - Book Buyer's Guide.",1960,3.75,197,3
9780029131695,0029131693,Tyranny of the Majority,Funamental Fairness in Representative Democracy,Lani Guinier,History,http://books.google.com/books/content?id=aRF7XdcCLq0C&printsec=frontcover&img=1&zoom=1&source=gbs_api,"At last...the public hearing she was denied...These essays reveal keen powers of analysis applied to some of the most obdurate problems that bedevil electoral politics. Anyone who cares about the mechanisms of democracy should be engaged by her tough-minded explorations. It doesn't matter where you think you stand: it's all here, to argue or agree with. -- Henry Louis Gates, Jr. Lani Guinier's fascinating book is a prophetic intervention into a public conversation we desperately need to rejuvenate. There is no doubt that her powerful voice will produce good consequences for our nation and world. -- Cornel West, Author of Race Matters Intriguing and desperately needed... -- The San Francisco Chronicle",1995,3.82,352,39
9780029221303,0029221307,The Origins of the Civil Rights Movement,,Aldon D. Morris,History,http://books.google.com/books/content?id=7vyHY9DWcu8C&printsec=frontcover&img=1&zoom=1&edge=curl&source=gbs_api,A blending of scholarly research and interviews with many of the figures who launched the civil rights movement in the 1960s and 1970s records the events of the movement's tumultuous first decade,1986,4.04,368,145
9780029227961,0029227968,Presidential Power and the Modern Presidents,The Politics of Leadership from Roosevelt to Reagan,Richard E. Neustadt,History,http://books.google.com/books/content?id=elGozulX_o8C&printsec=frontcover&img=1&zoom=1&edge=curl&source=gbs_api,"Suggests a theory of presidential power, and tests it against the events in the administrations of the postwar presidents",1991,3.79,384,277
9780030420566,0030420563,"Rest, Rabbit, Rest",,Jacquelyn Reinach;Richard Hefter,Juvenile Fiction,http://books.google.com/books/content?id=8-40_Zrp5voC&printsec=frontcover&img=1&zoom=1&source=gbs_api,Rabbit's schedule keeps him so busy his friends have to trick him into resting.,1978,4.01,32,88
9780030547744,0030547741,Where the Red Fern Grows,The Story of Two Dogs and a Boy : with Connections,Wilson Rawls,Juvenile Fiction,http://books.google.com/books/content?id=IHpRwgEACAAJ&printsec=frontcover&img=1&zoom=1&source=gbs_api,A young boy living in the Ozarks achieves his heart's desire when he becomes the owner of two redbone hounds and teaches them to be champion hunters.,2000,4.37,288,95
9780060000141,0060000147,Poppy's Return,,Avi,Juvenile Fiction,http://books.google.com/books/content?id=XbcMJQAACAAJ&printsec=frontcover&img=1&zoom=1&source=gbs_api,"There's trouble at Gray House, the girlhood home that Poppy left long ago. Poppy's family has called her back to save them all—mother, father, sisters and brothers, and dozens and dozens of deer mouse cousins. Poppy invites her rebellious son, Junior, to join her on the long trip across Dimwood Forest, hoping the journey will bring them closer together. But with Junior's skunk pal, Mephitis, and Ereth, the cantankerous porcupine, in tow—sugared slug soup!—Poppy and Junior may be in for unexpected adventure.",2006,3.99,256,1086
9780060001537,0060001534,Diary of a Spider,,Doreen Cronin,Juvenile Fiction,http://books.google.com/books/content?id=UWvZo2pIhzMC&printsec=frontcover&img=1&zoom=1&source=gbs_api,"This is the diary ... of a spider. But don't be worried – he's more scared of you and your gigantic shoe! Actually, he's a lot like you. He goes to gym class and has Grandparents' Day at school. But he also spins sticky webs, scales walls, and takes wind–catching lessons. Lucky for him, his best friend is a fly! Doreen Cronin and Harry Bliss, the team behind the #1 bestselling Diary Of A Worm, spin a hilarious tale about the upside–down web world of an eight–legged charmer and his unlikely friend, Fly.",2005,4.25,40,7903
9780060004507,0060004509,An Old-Fashioned Thanksgiving,,Louisa May Alcott;James Bernardin,Juvenile Fiction,http://books.google.com/books/content?id=SKYr4V6C1M0C&printsec=frontcover&img=1&zoom=1&source=gbs_api,An adaptation of the original story follows the activities of seven children in nineteenth-century New England as they prepare for the Thanksgiving holiday while Mother is away caring for Grandmother.,2005,3.7,32,599
9780060005696,0060005696,The Paradox of Choice,Why More Is Less,Barry Schwartz,Business & Economics,,"The author of The Battle for Human Nature explains why too much choice has led to the ever increasing complexity of everyday decisions, why too much of a good thing has become detrimental to human psychological and emotional well-being, and how to focus our lives on making the right choices. Reprint. 35,000 first printing.",2005,3.84,265,23734
9780060009427,006000942X,How to Read Literature Like a Professor,a Lively and Entertaining Guide to Reading Between the Lines,Thomas C. Foster,Literary Criticism,http://books.google.com/books/content?id=irkUlwEACAAJ&printsec=frontcover&img=1&zoom=1&source=gbs_api,"What does it mean when a fictional hero takes a journey?. Shares a meal? Gets drenched in a sudden rain shower? Often, there is much more going on in a novel or poem than is readily visible on the surface—a symbol, maybe, that remains elusive, or an unexpected twist on a character—and there's that sneaking suspicion that the deeper meaning of a literary text keeps escaping you. In this practical and amusing guide to literature, Thomas C. Foster shows how easy and gratifying it is to unlock those hidden truths, and to discover a world where a road leads to a quest; a shared meal may signify a communion; and rain, whether cleansing or destructive, is never just rain. Ranging from major themes to literary models, narrative devices, and form, How to Read Literature Like a Professor is the perfect companion for making your reading experience more enriching, satisfying, and fun.",2003,3.65,314,14917
9780060012342,006001234X,The Amazing Maurice and His Educated Rodents,,Terry Pratchett,Juvenile Fiction,http://books.google.com/books/content?id=1Z8KJQAACAAJ&printsec=frontcover&img=1&zoom=1&source=gbs_api,"Winner of the 2001 Carnegie Medal One rat, popping up here and there, squeaking loudly, and taking a bath in the cream, could be a plague all by himself. After a few days of this, it was amazing how glad people were to see the kid with his magical rat pipe. And they were amazing when the rats followed hint out of town. They'd have been really amazed if they'd ever found out that the rats and the piper met up with a cat somewhere outside of town and solemnly counted out the money. The Amazing Maurice runs the perfect Pied Piper scam. This streetwise alley cat knows the value of cold, hard cash and can talk his way into and out of anything. But when Maurice and his cohorts decide to con the town of Bad Blinitz, it will take more than fast talking to survive the danger that awaits. For this is a town where food is scarce and rats are hated, where cellars are lined with deadly traps, and where a terrifying evil lurks beneath the hunger-stricken streets.... Set in Terry Pratchett's widely popular Discworld, this masterfully crafted, gripping read is both compelling and funny. When one of the world's most acclaimed fantasy writers turns a classic fairy tale on its head, no one will ever look at the Pied Piper -- or rats -- the same way again!",2001,4.05,256,27463
9780060012380,0060012382,The Wee Free Men,,Terry Pratchett,Juvenile Fiction,http://books.google.com/books/content?id=8PLblgEACAAJ&printsec=frontcover&img=1&zoom=1&source=gbs_api,"A nightmarish danger threatens from the other side of reality . . . Armed with only a frying pan and her common sense, young witch-to-be Tiffany Aching must defend her home against the monsters of Fairyland. Luckily she has some very unusual help: the local Nac Mac Feegle—aka the Wee Free Men—a clan of fierce, sheep-stealing, sword-wielding, six-inch-high blue men. Together they must face headless horsemen, ferocious grimhounds, terrifying dreams come true, and ultimately the sinister Queen of the Elves herself. . . . A Story of Discworld",2004,4.27,390,72982
